{
  "name": "VIGOR",
  "url": "https://github.com/JCVI-VIRIFX/VIGOR4",
  "doi": "10.1186/1471-2105-11-451",
  "bibtex": "@article{wang2010vigor,\n  title={VIGOR, an annotation program for small viral genomes},\n  author={Wang, Shiliang and Sundaram, Jyothi Purushe and Spiro, David},\n  journal={BMC Bioinformatics},\n  volume={11},\n  number={1},\n  pages={1--10},\n  year={2010},\n  publisher={BioMed Central}\n}",
  "description": "Viral genome ORF reader for annotation of viral genomes, including RNA viruses",
  "date": "2010-09-01",
  "version": "4.1.20200702",
  "license": "GPL-3.0",
  "language": "Perl",
  "topics": ["genome-annotation", "orf-prediction", "viral-genomes", "rna-viruses"],
  "package_managers": ["bioconda"]
}