{
  "name": "ViralMSA",
  "type": "tool",
  "url": "https://github.com/niemasd/ViralMSA",
  "doi": "10.1093/bioinformatics/btaa743",
  "bibtex": "@article{moshiri2020viralmsa title={ViralMSA: massively scalable reference-guided multiple sequence alignment of viral genomes} author={Moshiri, Niema} journal={Bioinformatics} volume={37} number={5} pages={714--716} year={2021} publisher={Oxford University Press}\n}",
  "description": "Massively scalable reference-guided multiple sequence alignment of viral genomes, including RNA viruses",
  "date": "2020-08-15",
  "version": "1.1.44",
  "license": "GPL-3.0",
  "language": "Python",
  "topics": ["phylogenetics", "multiple-sequence-alignment", "viral-genomes", "rna-viruses"],
  "package_managers": ["bioconda"]
}